{
  "$schema": "https://json-schema.org/draft/2020-12/schema",
  "$id": "https://example.com/hermes-personal-hub/undo-record.schema.json",
  "title": "Personal Hub Undo Record",
  "type": "object",
  "required": ["id", "created_at", "change_id", "reason", "operations"],
  "additionalProperties": true,
  "properties": {
    "id": { "type": "string", "minLength": 1 },
    "created_at": { "type": "string", "minLength": 1 },
    "change_id": { "type": "string", "minLength": 1 },
    "patch_id": { "type": "string" },
    "reason": { "type": "string", "minLength": 1 },
    "operations": {
      "type": "array",
      "minItems": 1,
      "items": {
        "type": "object",
        "required": ["op"],
        "additionalProperties": true,
        "properties": {
          "op": { "type": "string", "minLength": 1 }
        }
      }
    }
  }
}
